{
  "schema_version": 1,
  "slug": "metric-spaces",
  "title": "距離空間から距離化可能性へ",
  "description": "距離空間の基本的な性質から出発し、位相空間がいつ距離から生じるかをたどる経路です。",
  "difficulty": "学部後半から",
  "prerequisites": [],
  "papers": [
    {"slug": "2015-10-09-01", "guide": "まず距離空間で使う基本事項を見渡します。"},
    {"slug": "2016-01-09-01", "guide": "コンパクト性・全有界性・完備性の関係を整理します。"},
    {"slug": "2016-01-18-01", "guide": "距離化可能定理を読むための入口です。"},
    {"slug": "2016-01-22-02", "guide": "Bing–Nagata–Smirnov型の特徴付けへ進みます。"},
    {"slug": "2016-01-22-01", "guide": "Alexandroff–Urysohn–Tukey型の道具を確認します。"},
    {"slug": "2016-01-29-01", "guide": "近傍系を用いた距離化の考え方を追います。"},
    {"slug": "2024-01-23-01", "guide": "花井–森田・Stoneの定理まで見通します。"}
  ]
}
