{
  "schema_version": 1,
  "slug": "dimension-theory",
  "title": "位相次元の短い経路",
  "description": "0次元から被覆次元、埋め込みへ進み、近年の次元論原稿を順番に読む経路です。",
  "difficulty": "大学院初年級",
  "prerequisites": ["metric-spaces"],
  "papers": [
    {"slug": "2022-03-12-03", "guide": "0次元を入口に位相次元の考え方を導入します。"},
    {"slug": "2026-06-27-01", "guide": "正規空間の被覆次元を扱います。"},
    {"slug": "2026-06-28-01", "guide": "被覆次元とユークリッド空間への埋め込みを結びます。"},
    {"slug": "2026-07-02-01", "guide": "可分距離化可能空間における次元論をまとめて読みます。"}
  ]
}
